name,servings,ingredients,directions,type,calories,cholesterol,fat,carbohydrates,fiber,sugars,protein,calcium,iron,vitamin_a,vitamin_c,vitamin_d,folate
Apple Oatmeal Muffins,6 Muffins,"['1/2 cup milk, non-fat', '1/3 cup applesauce', '1/2 cup flour, all-purpose', '1/2 cup quick-cooking oats (uncooked)', '1 cup sugar', '1/2 tablespoon baking powder', '1/2 teaspoon ground cinnamon', '1 apple (tart, cored & chopped)']","['Wash hands with soap and water.', 'Preheat oven to 400 °F.', 'Place 6 cupcake holders in baking tin.', 'In a mixing bowl, add milk and applesauce. Stir until blended.', 'Stir in flour, oats, sugar, baking powder, and cinnamon. Mix until moistened (do not over mix).', 'Gently stir in the chopped apples.', 'Spoon into cupcake holders.', 'Bake for 15-20 minutes or until an inserted toothpick comes out clean.', 'Cool in pan 5 minutes before serving. Store unused portions in an airtight container.']",Breads,125,0 mg,1 g,28 g,2 g,14 g,3 g,101 mg,1 mg,13 mcg RAE,1 mg,0 mcg,34 mcg DFE
Banaha Bread,6 Servings,"['6 cups water', '4-6 handfuls corn shucks', '2 cups cornmeal', '1 teaspoon baking soda', '1 teaspoon salt']","['In a large pot, bring 6 cups of water to a boil over medium to high heat.', 'Boil corn shucks for about 10 minutes. Remove carefully.', 'Strip a few shucks into strings. Tie two strings together to make longer strings.', 'In a medium-sized bowl, mix the dry ingredients.', 'Keep mixing and slowly add a little water until the mixture is firm enough to handle easily.', 'Form cornmeal mixture into 8 oval shaped balls about 3 inches long.', 'Wrap the balls in corn shucks and tie the ends closed with the corn shuck strings.', 'Gently put wrapped balls into the large pot of boiling water. The pot should be about 2/3 full of water. Cover the pot with a lid and cook for 30-45 minutes over medium to high heat.', 'Remove corn shuck covering and serve hot.']",Breads,127,0 mg,1 g,27 g,1 g,0 g,3 g,10 mg,1 mg,4 mcg RAE,0 mg,0 mcg,10 mcg DFE
Banana Berry Muffins,12 Servings,"['nonstick cooking spray', '1/4 cup applesauce', '1/4 cup sugar', '2 tablespoons dried egg mix (or 1 egg)', '2 ripe bananas, mashed', '2 tablespoons water', '1/4 cup all-purpose flour', '1/4 cup whole wheat flour', '1/4 cup quick cooking oats', '1/2 teaspoon baking powder', '1/2 teaspoon baking soda', '1/4 teaspoon salt', '1/4 cup blueberries or strawberries (fresh or frozen)']","['Preheat oven to 350 °F. Spray a 12-cup muffin pan with non-stick cooking spray.', 'In a medium-size bowl, combine applesauce, sugar, dried egg mix, banana, and water. Mix well.', 'In a large bowl mix flours, oats, baking powder, baking soda, and salt.', 'Add the applesauce mixture to the bowl with the dry ingredients; mix just until the batter is moist.', 'Gently add berries into the mixture.', 'Fill each muffin cup about 3/4 full of batter.', 'Bake for 25-30 minutes until lightly brown.', 'Cool for 10 minutes and remove from pan.']",Breads,75,26 mg,1 g,15 g,1 g,8 g,2 g,17 mg,0 mg,2 mcg RAE,,4 mcg,16 mcg DFE
Banana Bread,12 servings,"['3 bananas (large, well-ripened)', '1 egg', '2 tablespoons vegetable oil', '1/3 cup milk, fat-free', '1/3 cup sugar', '1 teaspoon salt', '1 teaspoon baking soda', '1/2 teaspoon baking powder', '1 1/2 cups flour']","['Wash hands with soap and water.', 'Preheat the oven to 350 °F.', 'Peel the bananas. Put them in a mixing bowl. Mash the bananas with a fork.', 'Add the egg, oil, milk, sugar, salt, baking soda, and baking powder. Mix well with the fork.', 'Slowly stir the flour into the banana mixture. Stir for 20 seconds until the flour is moistened.', 'Lightly grease the bread pan with a little oil or cooking spray. Or, line the pan with wax paper.', 'Pour the batter into the bread pan.', 'Bake for 45 minutes until a toothpick inserted near the middle comes out clean.', 'Let the bread cool for 5 minutes before removing it from the pan.']",Breads,137,16 mg,3 g,26 g,1 g,10 g,3 g,26 mg,1 mg,12 mcg RAE,3 mg,0 mcg,55 mcg DFE
Basic Muffins,12 Muffins,"['1/4 cup oil', '1 cup sugar', '1 egg', '1 1/4 cups applesauce', '1 1/2 teaspoons cinnamon', '1 teaspoon baking soda', '1/4 teaspoon salt', '1 cup all-purpose flour', '1 cup whole wheat flour', 'carrots, raisins, and/or walnuts (optional)', '1/2 milk (1/2 cup optional, only if adding carrots, raisins or walnuts)']","['Preheat oven to 350 °F.', 'Line muffin tin with paper baking cups or grease bottom of tin with cooking spray.', 'Cream margarine and sugar with an electric mixer, or by hand.', ' Add egg, milk, and applesauce, mixing well.', 'Blend in cinnamon, baking soda, salt, and flour.', 'Add carrots, raisins, and/or walnuts if desired. If any of these items are added, also add milk and mix.', 'Fill muffin tins 2/3 full and bake for 15 to 18 minutes.']",Breads,201,16 mg,5 g,37 g,2 g,21 g,3 g,12 mg,1 mg,7 mcg RAE,0 mg,0 mcg,37 mcg DFE
Blue Corn Pan Bread,12 servings,"['3 cups water', '2 cups blue cornmeal (yellow may be used)', '1 cup cornmeal (yellow)', '3/4 cup raisins', '1/2 cup sprouted wheat', '1/3 cup brown sugar']","['Wash hands with soap and water.', 'Preheat oven to 300 °F. Line 8x8 inch cake pan with foil.', 'Bring water to boil in a large pot. Add each ingredient, one at a time.', 'Stir well until mixture is smooth and pour into foil-lined cake pan. Cover with a piece of aluminum foil.', 'Bake for 2 hours. Bread is done when toothpick inserted in center comes out clean.']",Breads,182,,2 g,40 g,3 g,12 g,4 g,15 mg,1 mg,,0 mg,,
Blueberry Muffins,12 servings,"['1/2 cup vegetable oil', '1 cup sugar', '2 eggs', '1/2 cup milk, low-fat', '1 teaspoon vanilla', '2 cups flour', '2 teaspoons baking powder', '1/2 teaspoon salt', '2 cups blueberries (fresh or frozen)']","['Preheat the oven to 375 °F.', 'Grease the muffin pans.', 'In a large mixing bowl, stir the oil and sugar until creamy.', 'Add eggs, milk and vanilla. Mix until blended.', 'In a medium mixing bowl, stir together the flour, baking powder, and salt.', 'Add the flour mix to the oil and sugar in the large bowl. Stir together.', 'Stir the blueberries into the batter.', 'Fill each muffin cup 2/3 full with batter.', 'Bake for 25 to 30 minutes.']",Breads,252,32 mg,10 g,37 g,1 g,20 g,4 g,67 mg,1 mg,20 mcg RAE,2 mg,0 mcg,67 mcg DFE
Bran Flake Raisin Muffins,10 Muffins,"['1/2 cup flour, all-purpose', '3/4 cup flour, whole wheat', '1/4 teaspoon salt', '2 teaspoons baking soda', '1/2 cup sugar', '1 3/4 cups bran flake cereal with raisins', '1 egg', '1 cup buttermilk', '2 tablespoons vegetable oil']","['Wash hands with soap and water.', 'Preheat oven to 425 °F. Spray or grease the bottoms of a muffin tin.', 'Put flour in a large bowl. Add salt, baking soda, and sugar. Mix well.', 'Stir in the bran flake cereal. Mix well.', 'Make a well in the center of mixture and set aside.', 'In another bowl, beat the egg, buttermilk, and oil together.', 'Pour the egg mixture into the well of the cereal mixture and stir until all ingredients are moist. Do not over mix.', 'Fill the tins 2/3 full.', 'Bake for 15-20 minutes or until golden brown.', 'If not eaten right away, wrap the baked muffins in foil or a plastic bag and store in the freezer. Thaw for 15 seconds in the microwave or overnight in the refrigerator.']",Breads,167,19 mg,4 g,30 g,2 g,15 g,4 g,210 mg,4 mg,45 mcg RAE,0 mg,1 mcg,143 mcg DFE
Bran Muffins,30 servings,"['5 cups flour', '2 teaspoons salt', '2 teaspoons baking soda', '3 cups sugar', '8 cups raisin bran (about 15 oz)', '4 eggs (beaten)', '4 cups buttermilk', '1 cup oil', 'vegetable oil spray (or oil)']","['Measure flour into 1-gallon container.', 'Add salt, soda, sugar and raisin bran to the flour and mix well with spoon.', 'With a spoon make a ""well"" in the center of the dry ingredients.', 'In the medium size bowl, beat the eggs with a fork until whites and yolk are evenly blended.', 'Add milk and oil to eggs. Beat with fork.', 'Add liquid to dry ingredients. Stir until dry ingredients are moistened (mixture will be lumpy).', 'Lightly oil the bottoms of the paper cups in the muffin pan (or use muffin cups). Fill the muffin cups to 3/4 full.', 'Bake at 425 °F for 15-20 minutes.', 'Baked muffins can be frozen for future use.']",Breads,293,28 mg,9 g,49 g,2 g,27 g,5 g,311 mg,6 mg,66 mcg RAE,0 mg,1 mcg,245 mcg DFE
Bread in a Bag,12 servings,"['2 cups flour (all-purpose, plus extra for kneading)', '1 cup flour (whole wheat)', '3 tablespoons milk (powdered, nonfat)', '3 tablespoons sugar', '1 teaspoon salt', '1 tablespoon yeast (rapid rise)', '3 tablespoons vegetable oil', '1 cup water (warm, 120 to 130 °F)', 'flour (as needed, extra, for kneading)']","['Wash hands with soap and water.', 'Combine flour, whole wheat flour, yeast, sugar, salt and powdered milk in a one gallon resealable freezer bag. Squeeze upper part of bag to force out air and seal bag. Shake and work bag with fingers to blend ingredients.', 'Add oil and warm water to dry ingredients. Reseal bag. Mix by working bag with fingers until dough is completely mixed and pulls away from bag.', 'On a floured surface, knead dough 5 minutes or until smooth and elastic, adding flour as needed. Put dough back into bag and let it rest 10 minutes.', 'Shape dough on greased baking sheet or put into a 4x8 inch greased loaf pan. Cover with a clean cloth or plastic wrap and let rise until doubled in bulk.', 'Preheat oven to 350 °F and bake for about 30 minutes or until golden brown. (This may take between 25 and 45 minutes to bake.)', 'Remove from pan and cool on a wire rack or clean dish towel.']",Breads,159,0 mg,4 g,27 g,2 g,4 g,4 g,21 mg,1 mg,8 mcg RAE,0 mg,0 mcg,89 mcg DFE
Chapatis Flatbread,6 servings,"['2 cups whole wheat flour', '2/3 cup water (warm)', '2 teaspoons vegetable oil', '1 dash salt']","['Wash hands with soap and water.', 'Place the flour in a large mixing bowl. Add water, oil, and salt. Mix with fork and then with hands. Keep mixing until you can make a ball.', 'Knead the dough for about 10 minutes. Let rest for 30 minutes in the bowl, covered with a damp cloth.', 'Roll the ball into a 12-inch log and cut into 6 chunks.', ""Roll each chunk into a very thin pancake, about 7 inches in diameter. Don't worry about making the dough into a perfect circle-just try to get it as thin as you can."", 'Heat a cast iron skillet (lightly greased) on medium-high heat. Place one chapati in the skillet and cook for 30 seconds.', 'Use a spatula to lift bread. When chapati gets brown spots and bubbles, flip it over and cook for another 30 seconds.', 'Wrap the cooked chapati in a cloth napkin while cooking the rest.', 'Eat them right away with a little butter or margarine, or use as scoops for eating other dishes.']",Breads,149,0 mg,3 g,29 g,4 g,0 g,5 g,14 mg,1 mg,0 mcg RAE,0 mg,0 mcg,18 mcg DFE
Cinnamon Sugared Pumpkin Pecan Muffins,12 Servings,"['8 tablespoons sugar (divided)', '2 teaspoons cinnamon (divided)', '1 cup bran flakes', '1 cup skim milk', '1 cup flour', '1 tablespoon baking powder', '1/2 teaspoon baking soda', '1 cup canned pumpkin', '1 egg', '1 tablespoon vanilla', '1/4 cup finely chopped pecans']","['Wash hands with soap and water.', 'Preheat oven to 400 °F. Spray 12 muffin cups with cooking spray.', 'Combine 2 tablespoons sugar and 1/2 teaspoon cinnamon in a small bowl; set aside.', 'In a large bowl, combine cereal and milk and set aside for 5 minutes.', 'Combine 6 tablespoons sugar, 1 1/2 teaspoons cinnamon, flour, baking powder, and baking soda in a bowl. Whisk pumpkin, egg, and vanilla into cereal.', 'Fold in dry mixture; being careful not to over mix. Spoon into prepared pan and sprinkle with pecans and sugar-cinnamon mixture.', 'Bake for 20 to 25 minutes or until a toothpick comes out clean.']",Breads,125,16 mg,2 g,23 g,2 g,11 g,3 g,109 mg,1 mg,177 mcg RAE,1 mg,0 mcg,38 mcg DFE
Corn Bread,12 servings,"['1 cup cornmeal', '1 cup flour (all purpose)', '2 tablespoons sugar', '1 tablespoon baking powder', '1 egg', '1/4 cup vegetable oil', '1 cup milk, non-fat']","['Wash hands with soap and water.', 'Heat oven to 425 °F. Grease 8x9 inch pan.', 'Measure cornmeal, flour, sugar, and baking powder into a large mixing bowl. Stir to combine ingredients.', 'Crack egg into a small bowl and beat with a fork to combine white and yolk.', 'Add egg, oil, and milk to flour mixture. Mix until ingredients are well blended.', 'Pour batter into prepared pan.', 'Bake 20 to 25 minutes, until firm to touch or wooden pick inserted in the center comes out clean.']",Breads,137,16 mg,5 g,19 g,1 g,3 g,3 g,97 mg,1 mg,20 mcg RAE,0 mg,0 mcg,36 mcg DFE
Corn Toasties,18 servings,"['2 cups cornmeal', '1 cup all-purpose flour (sifted)', '2 tablespoons sugar', '1 1/2 tablespoons baking powder', '1/4 teaspoon salt', '1/2 teaspoon baking soda', '3/4 cup buttermilk (made from 2 teaspoons vinegar + 3/4 cup milk, made from non-fat dry milk powder)', '1/4 cup egg mix (dry, mixed with 1/4 cup water)', '2 tablespoons vegetable oil']","['Wash hands with soap and water.', 'In a large bowl, combine cornmeal, flour, sugar, baking powder, salt, and baking soda.', 'In another bowl, combine buttermilk, egg mix, and vegetable oil. Beat until well blended.', 'Add buttermilk mixture all at once to dry ingredients. Stir until well mixed.', 'Turn mixture onto a lightly floured board and knead only 10 times.', 'Roll out to a thickness of 1/4 inch and cut with a 3/4-inch-round cutter.', 'Cook on a warm ungreased griddle or frying pan for about 10 minutes on each side.']",Breads,112,21 mg,3 g,18 g,1 g,2 g,3 g,85 mg,1 mg,9 mcg RAE,,6 mcg,27 mcg DFE
Corn Tortillas,12 servings,"['2 cups masa harina (instant)', '1/4 teaspoon salt', '2 tablespoons unsalted butter (at room temperature)', '1 1/2 cups water (warm)']","['Wash hands with soap and water.', 'Measure the masa harina and salt into a large bowl. Cut the butter into tablespoon-sized pieces and work it into the dry ingredients using the back of a wooden spoon. Add the water and mix with a wooden spoon or with your hands until a soft dough forms. Cover the dough with a clean cloth and let rest for 5 minutes.', 'Divide the dough into 12 pieces and roll each piece into a ball.', 'To keep the dough from sticking to the tortilla press, put a piece of plastic wrap (or a plastic bag) on the bottom surface of the press. Put a ball of dough in the center of the plastic. Then place another piece of plastic wrap on the top of the dough. Press the dough flat in the press.', 'Pick up the tortilla with the plastic on both sides. Peel off one piece of plastic (which can be reused). Flip the tortilla off of the plastic onto a hot griddle. Cook for 1 to 2 minutes, until the bottom of the tortilla becomes golden. Flip the tortilla and press lightly with a spatula, which will make the tortilla puff slightly. Cook for one to two minutes more, until the tortilla appears to be done.']",Breads,56,5 mg,2 g,8 g,1 g,0 g,1 g,19 mg,0 mg,16 mcg RAE,0 mg,0 mcg,14 mcg DFE
Cornmeal Pancakes,20 servings,"['2 cups cornmeal', '1 teaspoon baking powder', '1/2 teaspoon baking soda', '1 teaspoon salt', '1 teaspoon sugar', '2 tablespoons butter (or margarine)', '1 cup evaporated milk', '1 tablespoon vinegar', '1 egg']","['Wash hands with soap and water.', 'Measure, place in a bowl and mix cornmeal, baking powder, salt, and sugar.', 'Measure fat (butter or margarine), and add to cornmeal mixture. Bring water to a boil. Measure 1 3/4 cups boiling water, and add to cornmeal mixture. Beat until well mixed.', 'Measure evaporated milk, and pour into a small bowl. Measure vinegar, and stir into evaporated milk. Stir milk and vinegar mixture into cornmeal mixture. Beat to mix well. Beat in egg. Makes batter for 20 medium-sized pancakes.', 'Heat griddle or fry pan. (If electric fry pan is used, preheat it to 380 °F.) Pan is ""hot"" when a drop of water ""dances."" Grease pan lightly.', 'Pour batter onto griddle or fry pan. Use about 3 tablespoons batter for each pancake. A 1/4 cup measure is handy to use for pouring. Stir the batter up from the bottom now and then to keep it well mixed. Cook until top is covered with bubbles and the bottom is brown. Loosen edges of each pancake all around. Turn pancakes over and brown other side.']",Breads,76,16 mg,3 g,11 g,1 g,2 g,2 g,49 mg,1 mg,23 mcg RAE,0 mg,0 mcg,5 mcg DFE
Cranberry Nut Bread,15 Servings,"['2 cups flour*', '2/3 cup sugar', '1 1/2 teaspoons baking powder', '1 1/2 teaspoons baking soda', '2 teaspoons grated orange peel', '3/4 cup orange juice', '4 tablespoons butter, melted (or margarine) (1/4 cup)', '1 egg (or 2 egg whites) (medium)', '1 cup chopped cranberries', '1/3 cup chopped walnuts', '1/3 powdered sugar, optional (1/3 cup, for glaze)', '1 water, optional (1 teaspoon, for glaze)']","['Wash hands with soap and water.', 'Preheat oven to 350 °F. Mix flour, sugar, baking powder and baking soda in a large bowl.', 'Grate orange peeling, then squeeze juice from orange. Add additional orange juice to make 3/4 cup.', 'In a separate bowl, blend orange juice, butter, egg, and grated orange peel; add to flour mixture, stirring until just blended. Mix in cranberries and walnuts.', 'Pour batter into a 9x5 inch loaf pan, greased on bottom only.', 'Bake for 50 to 60 minutes or until a toothpick inserted in the center comes out clean. Cool in pan for 10 minutes; remove and cool completely on wire rack.', 'Optional: to make glaze, mix powdered sugar and water; add water as needed to make thin glaze. Drizzle over cooled loaf.']",Breads,163,19 mg,5 g,27 g,1 g,13 g,3 g,37 mg,1 mg,32 mcg RAE,8 mg,0 mcg,56 mcg DFE
Cranberry Pumpkin Muffins,12 servings,"['2 cups flour', '3/4 cup sugar', '3 teaspoons baking powder', '1/2 teaspoon salt', '1/2 teaspoon cinnamon', '3/4 teaspoon allspice', '1/3 cup vegetable oil', '2 eggs (large)', '3/4 cup pumpkin (canned)', '2 cups cranberries (fresh or frozen chopped)']","['Wash hands with soap and water.', 'Preheat oven to 400 °F.', 'Sift together dry ingredients (flour through allspice) and set aside.', 'Beat oil, eggs, and pumpkin together until well blended.', 'Add the wet ingredients (pumpkin mixture) to the dry ingredients all at once. Stir until moistened.', 'Fold in chopped cranberries.', 'Spoon into paper lined muffin cups.']",Breads,203,31 mg,7 g,32 g,2 g,14 g,3 g,83 mg,2 mg,133 mcg RAE,3 mg,0 mcg,66 mcg DFE
Drop Biscuits (from Better Baking Mix),10 Biscuits,"['2 Servings of Better Baking Mix (2 cups)', '1/4 cup vegetable oil', '1/4 cup water']","['Wash hands with soap and water.', 'Preheat oven to 400 °F. Lightly grease baking sheet.', 'Add oil and water to the dry mix. Stir just until all ingredients are wet.', 'Drop spoonsful 4 inches apart on baking sheet.', 'Bake 10 to 12 minutes until lightly browned.']",Breads,123,0 mg,6 g,14 g,1 g,1 g,3 g,54 mg,1 mg,14 mcg RAE,0 mg,0 mcg,36 mcg DFE
Fabulous Fruit Muffins,9 servings,"['1 1/4 cups flour', '1/4 cup sugar', '1 teaspoon baking powder', '1/2 teaspoon baking soda', '3/4 cup buttermilk, low-fat', '2 tablespoons margarine (melted)', '1 egg (slightly beaten)', '1/2 teaspoon vanilla extract', '1 cup frozen strawberries (coarsely chopped, or other fruit, fresh or frozen)']","['Wash your hands and work area.', 'Heat oven to 400 °F. Spray muffin tin with non-stick cooking spray.', 'In a large bowl, combine the flour, sugar, baking powder, and baking soda. Stir well until all ingredients are blended.', 'In another bowl, combine buttermilk, margarine, egg, and vanilla. Pour this mixture into the dry ingredients (made in step #3).', 'Using a large spoon, gently stir ingredients just until moist (do not over-mix). Add fruit and stir gently (do not over-mix).', 'Spoon batter evenly into 9 muffin cups.', 'Bake 20 to 25 minutes or until golden brown.', 'Serve hot or cold. Muffins may be frozen for later use.']",Breads,133,21 mg,3 g,22 g,1 g,8 g,3 g,64 mg,1 mg,38 mcg RAE,10 mg,0 mcg,58 mcg DFE
Feather Rolls,30 Servings,"['4 cups flour, whole wheat', '3/4 cup flour, all-purpose', '1 1/4 tablespoons yeast, dry active', '1 cup non-fat dry milk powder', '1 1/2 cups warm water', '1/3 cup oil', '3 tablespoons sugar (or honey)', '2 eggs, large (or 4 egg whites)', '1 teaspoon salt']","['Mix 2 1/2 cups whole wheat flour, dry yeast, and non-fat dry milk in large mixer bowl. Add water, oil, and sugar (or honey). Mix well 1 to 2 minutes.', 'Turn off mixer, cover, and let dough sit for 10 minutes.', 'Add eggs and salt. Turn on mixer. Add remaining flour, 1 cup at a time, until dough begins to form a ball.', 'Knead for 5 to 6 minutes. Dough should be very soft and manageable. Stiff dough produces heavy, dry rolls. If dough stiffens while mixing, drizzle a little warm water over dough as it kneads.', 'Dough may be used immediately or covered and stored in the refrigerator for several days.', 'Lightly oil hands and counter top if needed. Shape immediately into rolls. Let rise until very light.', 'Bake at 350 °F for 18 to 20 minutes. Do not overbake.']",Breads,103,13 mg,3 g,16 g,2 g,2 g,3 g,22 mg,1 mg,13 mcg RAE,0 mg,0 mcg,30 mcg DFE
Flour Tortillas,10 servings,"['2 cups flour (all-purpose, or 1 1/2 cup all purpose flour and 1/2 cup whole wheat flour)', '1 teaspoon baking powder', '1/2 teaspoon salt', '2 tablespoons vegetable oil (or shortening)', '1/2 cup water (warm, 105 to 110 °F)']","['In a large bowl, combine flour, baking powder, and salt.', 'Add oil and mix until crumbly.', 'Start with 1/2 cup of water and add 1 tablespoon at a time until mixture forms a loose crumbly ball.', 'Turn onto a lightly floured surface; knead 6 to 8 times or until smooth.', 'Divide into 10 balls. Roll each piece into an 8 inch circle.', 'Heat a 12 inch dry skillet over medium-high heat. Place one tortilla at a time into skillet and cook until light brown spots appear on bottom. Turn over and cook on other side until lightly browned.']",Breads,115,0 mg,3 g,19 g,1 g,0 g,3 g,31 mg,1 mg,0 mcg RAE,0 mg,0 mcg,73 mcg DFE
Garden Pan Bread,4 Servings,"['1/2 cup cornmeal', '1/2 cup all-purpose flour', '1 teaspoon baking powder', '1/4 teaspoon salt', '2 ripe bananas, mashed', '1/2 cup water', '1 tablespoon egg mix (or 1 egg)', '1/4 cup raisins', '1/4 cup walnuts, chopped', 'nonstick cooking spray']","['Preheat oven to 350 °F.', 'In a medium-sized bowl, combine cornmeal, flour, baking powder, and salt. Set aside.', 'In a small bowl, combine bananas, water, and egg mix. Stir until mixed well.', 'Stir banana mixture into cornmeal mixture. Mix until dry ingredients are moistened. Gently stir in raisins and walnuts.', 'Lightly spray medium-sized skillet or baking pan with nonstick cooking spray.', 'Spoon batter into skillet or baking pan.', 'Bake for 18 to 20 minutes or until bead is golden brown and pulls away from the edges. A wooden toothpick or clean fork inserted into the center of the bread should come out clean.', 'Cut into four equal slices and serve hot or cold.']",Breads,268,39 mg,7 g,48 g,4 g,13 g,7 g,90 mg,2 mg,6 mcg RAE,,6 mcg,72 mcg DFE
Ginger Bread Mix,10 servings,"['8 cups flour (white)', '1 1/2 cups sugar', '1 tablespoon baking soda', '3 tablespoons ginger (dried, ground)', '3 tablespoons cinnamon (dried, ground)', '1 teaspoon cloves (dried, ground)', '1 teaspoon salt']","['Combine all ingredients in a large bowl. Mix well.', 'Store mix in a covered jar until ready to use.']",Breads,492,0 mg,1 g,109 g,4 g,30 g,11 g,42 mg,5 mg,0 mcg RAE,0 mg,0 mcg,291 mcg DFE
Ginger Orange Muffins,12 servings,"['2 Servings Ginger Bread Mix (2 cups)', '1 cup bran cereal', '1 egg (slightly beaten)', '1/2 cup milk, 1%', '1/4 cup orange juice concentrate', '1/4 cup molasses', '1/4 cup vegetable oil', '1 teaspoon orange peel (grated)', '1/4 raisins (optional)']","['Preheat oven to 350 °F.', 'Combine the Ginger Bread Mix and bran cereal in a bowl.', 'Beat the egg slightly in another bowl.', 'Add the egg and other ingredients to the gingerbread and cereal mixture.', 'Stir only until combined. Let stand for 15 minutes.', 'Fill 12 muffin cups (well-greased pans or paper liners) 2/3 full.', 'Bake 15 to 20 minutes or until done in the center.']",Breads,178,16 mg,5 g,30 g,1 g,14 g,3 g,40 mg,2 mg,13 mcg RAE,2 mg,0 mcg,55 mcg DFE
Homemade Pizza Crust,4 Servings,"['1 teaspoon rapid rise yeast', '1/2 cup lukewarm water', '1/4 teaspoon salt', '1 teaspoon oil', '1 cup bread flour (approximately)']","['Wash hands with soap and water.', 'Mix yeast, water, salt, and oil. Add about 1 cup flour to make a stiff dough. The amount of flour may vary slightly.', 'Knead the dough until it is very elastic (will stretch and not make a hole).', 'Use a rolling pin or clean bottle to obtain even thickness.', 'Lay it on a greased baking sheet to rise while you prepare toppings for pizza.', 'Bake at 400°F with desired toppings until crust is browned and top is bubbly.']",Breads,137,0 mg,2 g,25 g,1 g,0 g,5 g,6 mg,2 mg,0 mcg RAE,0 mg,0 mcg,122 mcg DFE
Homestyle Biscuits,15 servings,"['2 cups flour (all purpose)', '2 teaspoons baking powder', '1/4 teaspoon baking soda', '1/4 teaspoon salt', '2 tablespoons sugar', '2/3 cup buttermilk (low-fat)', '3 tablespoons vegetable oil (+ 1 teaspoon vegetable oil)']","['Wash hands with soap and water.', 'Preheat oven to 450 °F.', 'In medium bowl, combine flour, baking powder, baking soda, salt, and sugar.', 'In small bowl, stir together buttermilk and oil. Pour over flour mixture and stir until well mixed.', 'On lightly floured surface, knead dough gently for 10-12 strokes. Roll or pat dough to ¾-inch thickness. Cut with a 2-inch round biscuit or cookie cutter, dipping cookie cutter in flour between cuts. Transfer biscuits to an ungreased baking sheet.', 'Bake for 12 minutes or until golden brown. Serve warm.']",Breads,96,0 mg,3 g,15 g,0 g,2 g,2 g,51 mg,1 mg,2 mcg RAE,0 mg,0 mcg,49 mcg DFE
