name,servings,ingredients,directions,type,calories,cholesterol,fat,carbohydrates,fiber,sugars,protein,calcium,iron,vitamin_a,vitamin_c,vitamin_d,folate
Frosted Cake,16 Servings,"['2 1/4 cups cake flour', '2 1/4 teaspoons baking powder', '4 tablespoons margarine (soft tub)', '1 1/4 cups sugar', '4 eggs', '1 teaspoon vanilla', '1 tablespoon orange (peel)', '3/4 cup skim milk (fat free)', 'cooking spray (for cake pan)']","['Preheat the oven to 325 °F.', 'Grease with small amount of cooking oil or use non-stick cooking oil spray on a 10-inch round pan (at least 2 1/2 inches high). Powder pan with flour. Tap out excess flour.', 'Sift together flour and baking powder.', 'In a separate bowl, beat together margarine and sugar until soft and creamy.', 'Beat in eggs, vanilla, and orange peel.', 'Gradually add the flour mixture alternating with milk, beginning and ending with flour.', 'Pour the mixture into the pan. Bake for 40-45 minutes or until done. Let cake cool for 5-10 minutes before removing from the pan. Let cool completely before icing.']",Desserts,253,50 mg,5 g,48 g,1 g,31 g,4 g,75 mg,2 mg,66 mcg RAE,0 mg,0 mcg,63 mcg DFE
Frozen Banana Pops,4 Servings,"['2 bananas, ripe', '1/8 cup orange juice or lemon juice (2 Tablespoons)']","['Wash hands with soap and water.', 'Peel each banana and cut in half (width-wise).', 'Insert craft stick into bottom of each banana half. Dip each banana half into juice.', 'Wrap in foil and freeze for two or more hours.']",Desserts,56,0 mg,0 g,14 g,2 g,8 g,1 g,4 mg,0 mg,3 mcg RAE,9 mg,0 mcg,14 mcg DFE
Frozen Fruit Cups,18 servings,"['3 bananas', '3 cartons yogurt, non-fat strawberry (8 ounces each)', '10 ounces strawberries, frozen (thawed and undrained)', '8 ounces crushed pineapple (undrained, canned)']","['Line 18 muffin-tin cups with paper baking cups.', 'Dice or mash bananas and place in a large mixing bowl.', 'Stir in remaining ingredients.', 'Spoon into muffin-tin cups and freeze at least 3 hours or until firm. Remove frozen cups and store in a plastic bag in freezer.', 'Before serving, remove paper cups and let stand 10 minutes.']",Desserts,67,1 mg,0 g,15 g,1 g,12 g,2 g,63 mg,0 mg,2 mcg RAE,10 mg,0 mcg,11 mcg DFE
Frozen Fruit Pops,4 servings,"['1 cup crushed pineapple', '1 cup yogurt, low-fat fruit (8 ounces)', '6 us fluid ounces orange juice, frozen concentrate (thawed)']","['Mix the ingredients in a medium-size bowl. Divide into 4 paper cups.', 'Freeze until slushy - about 60 minutes. Insert a wooden stick half way through the center of each fruit pop.', 'Freeze until hard or at least 4 hours. Peel away the paper cup before you eat the fruit pop.']",Desserts,121,2 mg,1 g,27 g,1 g,26 g,3 g,107 mg,0 mg,10 mcg RAE,25 mg,0 mcg,29 mcg DFE
Fruit Compote,5 servings,"['1 cup pineapple chunks (8 ounce can)', '1 1/2 cups orange juice', '1 tablespoon cornstarch', '1 banana (medium, peeled and sliced)', '1 pear (sliced in cubes)', '2 peaches (sliced in cubes)']","['Drain the juice from the canned pineapple into a small saucepan.', 'Stir in orange juice and cornstarch. Blend until smooth.', 'Bring to a boil over medium heat, stirring constantly.', 'Let the juice mix cool to room temperature.', 'While the juice mix is cooling, peel and slice the banana. Wash the pear and peaches and cut them into cubes.', 'Pour the cooled juice mix into a large bowl. Add the pieces of pineapple, banana, pear, and peaches. Stir together.']",Desserts,171,0 mg,1 g,43 g,4 g,34 g,2 g,32 mg,1 mg,20 mcg RAE,55 mg,0 mcg,37 mcg DFE
Fruit Crisp,8 Servings,"['3/4 cup white whole wheat flour', '3/4 cup rolled oats', '3 tablespoons white sugar', '1/4 cup brown sugar', '1/2 teaspoon salt', '1/3 cup canola oil (or unsalted butter, melted)', '6 cups apples (peeled and diced)', '1 tablespoon white whole wheat flour', '3 tablespoons white sugar']","['Preheat the oven to 350 °F. Lightly grease a baking dish with butter or oil.', 'To make the topping: Place the flour, oats, sugars and salt in the mixing bowl and toss together. Add the oil (or butter) and toss again.', 'For the filling, fill the baking pan with the fruit and the remaining 1 tablespoon flour and 3 tablespoons sugar. Mix well and then cover with the topping.', 'Transfer to the oven and bake until the fruit is tender and the topping is golden, about 45 minutes. Serve right away or cover and refrigerate up to 2 days.']",Desserts,167,0 mg,7 g,26 g,2 g,14 g,2 g,12 mg,1 mg,2 mcg RAE,3 mg,0 mcg,28 mcg DFE
Fruit Dip,4 servings,"['1 cup yogurt, low-fat vanilla (8 oz)', '1 us fluid ounce orange juice, 100% juice, frozen concentrate (thawed)', '1 tablespoon lime juice', '1 1/2 teaspoons brown sugar (1/2 tablespoon)', '2 apples (red, cored and sliced)', '1 pear (cored and sliced)', '1 peach (pitted and sliced)']","['In a small bowl, combine yogurt, orange juice concentrate, lime juice, and brown sugar.', 'Mix well.', 'Place bowl containing dip on a large plate and surround with fruit.']",Desserts,135,3 mg,1 g,30 g,4 g,25 g,4 g,117 mg,0 mg,16 mcg RAE,12 mg,0 mcg,17 mcg DFE
Fruit Dippers,4 servings,"['1/2 cup yogurt, low-fat vanilla', '2 cups peanuts (chopped)', '2 cups fruit (grapes, banana slices, apple wedges, strawberries)']","['Wash hands with soap and water.', 'Combine yogurt and peanuts. Mix with a spoon.', 'Place a toothpick in the center of each fruit.', 'Dip fruit into the yogurt peanut mixture.']",Desserts,99,2 mg,3 g,17 g,2 g,13 g,3 g,64 mg,0 mg,26 mcg RAE,19 mg,0 mcg,21 mcg DFE
Fruit Juice Slush,6 servings,"['12 ounces fruit juice concentrate (100%)', '12 us fluid ounces water', '3 cups ice']","['In a blender, place juice concentrate, water, and half of ice.', 'To prevent spillage, do not pass the top line of the blender.', 'Blend while gradually adding remaining ice. Serve.']",Desserts,25,0 mg,0 g,6 g,0 g,6 g,0 g,8 mg,0 mg,1 mcg RAE,21 mg,0 mcg,2 mcg DFE
Fruit Kabob,8 Servings,"['1 1/2 cups ripe banana slices (about 16 slices)', '1 1/2 cups watermelon cubes (about 16 cubes)', '1 cup clementine sections (about 16 sections)']","['Thread the fruit onto the skewers, alternating and arranging the pieces however you like.', 'Serve right away.']",Desserts,84,0 mg,0 g,22 g,2 g,14 g,0 g,12 mg,0 mg,49 mcg RAE,25 mg,0 mcg,15 mcg DFE
Fruit Milk Shakes,2 servings,"['1 cup milk (or water)', '1/2 cup non-fat dry milk', '2 bananas (ripe, or 1/3 cup orange juice concentrate)', '1/2 teaspoon vanilla', '10 large ice cubes']","['Place everything together into a blender.', 'Blend for 30 seconds to 1 minute.']",Desserts,214,6 mg,1 g,42 g,3 g,30 g,11 g,368 mg,0 mg,199 mcg RAE,11 mg,3 mcg,38 mcg DFE
Fruit Pizza,12 servings,"['1 teaspoon vanilla extract', '1 cup strawberries, sliced (or kiwifruit, bananas, pears, peaches, or blueberries)', '1/2 cup margarine', '1/2 cup sugar', '1 teaspoon vanilla extract', '1 egg (large)', '2 cups flour', '2 teaspoons baking powder', '8 ounces cream cheese, non-fat or light', '1/2 cup sugar']","['Wash hands with soap and water.', 'Preheat oven to 375 °F.', 'For crust, cream margarine, sugar vanilla, and egg until light and fluffy. Add flour and baking powder, mixing well.', 'Spread mixture about 1/8 inch thick on a pizza pan, baking sheet, or 9x13 inch pan.', 'Bake for 10 to 12 minutes or until lightly browned. Cool.', 'For spread, mix together cream cheese, sugar, and vanilla. Spread on cooled cookie crust.', 'Arrange fruit on top of pizza. Refrigerate until serving time.']",Desserts,240,18 mg,8 g,35 g,1 g,19 g,6 g,120 mg,1 mg,86 mcg RAE,8 mg,0 mcg,73 mcg DFE
Fruit Salad with Yogurt,4 Servings,"['2 cups strawberries (sliced)', '1 cup blueberries (rinsed)', '1 cup pineapple chunks (canned, or fresh)', '3 tablespoons pineapple juice', '2 cups plain low-fat yogurt', '1/8 cup almonds (sliced or slivered )']","['Place fruit in a large bowl and mix with pineapple juice. Let stand for 15 minutes at room temperature.', 'Place 1 cup of fruit salad in a small bowl and top with 1/2 cup of yogurt.', 'Sprinkle almonds on top of each fruit salad. Serve immediately.']",Desserts,171,7 mg,4 g,28 g,4 g,22 g,8 g,264 mg,1 mg,20 mcg RAE,78 mg,0 mcg,47 mcg DFE
Fruit Salsa,4 servings,"['1 cup strawberries (diced)', '1 banana (diced)', '1 kiwifruit (peeled and diced)', '1 apple (cored and diced)', '2 tablespoons lemon juice', '1/4 cup sugar', '1/4 teaspoon nutmeg', '1/4 teaspoon cinnamon']","['Wash hands with soap and water.', 'Combine fruits in a medium mixing bowl and add lemon juice.', 'Stir in sugar, nutmeg, and cinnamon. Mix well.', 'Refrigerate until serving time.']",Desserts,120,0 mg,0 g,31 g,3 g,24 g,1 g,19 mg,0 mg,3 mcg RAE,48 mg,0 mcg,23 mcg DFE
Fruit Slush,4 servings,"['2 2/3 cups cantaloupe or watermelon (coarsely chopped, seeded, peeled)', 'kiwifruit (1 2/3 cup coarsely chopped, optional)', 'sugar (2 tablespoons, optional)', '2 tablespoons lime juice', '2 cups water', 'ice']","['Wash hands with soap and water.', 'In a blender, puree fruit with sugar and lime juice until smooth.', 'Combine fruit mixture and water in a large pitcher.', 'If desired, pour through a strainer to eliminate pulp.', 'Cover and refrigerate for up to a week.', 'To serve, stir well and pour into tall glasses over ice.']",Desserts,37,0 mg,0 g,9 g,1 g,8 g,1 g,14 mg,0 mg,176 mcg RAE,40 mg,0 mcg,23 mcg DFE
Fruit Sorbet,7 Servings,"['2 cans sliced peaches in 100% juice (15-ounce cans)', 'banana, peeled (optional)']","['Collect all ingredients and freeze cans before starting to prepare the recipe.', 'Place cans of fruit in freezer for at least 3 hours. Take out when fully frozen.*', 'Run frozen cans briefly under hot water, or let them sit on counter for 30 minutes to loosen contents. Remove fruit from the cans, and use a sharp knife to cut it into small pieces.', 'If using a banana, peel, and cut into slices. Banana does not need to be frozen.', 'Place frozen, chopped fruit (and banana, if using) in the blender, and blend until creamy.', 'Serve immediately.', 'Freeze any leftovers in a freezer-safe container or sealable plastic freezer bags.']",Desserts,53,0 mg,0 g,14 g,2 g,12 g,1 g,7 mg,0 mg,23 mcg RAE,4 mg,0 mcg,4 mcg DFE
Fruit Yogurt Parfait,1 serving,"['1/2 cup yogurt, fruit-flavored (low-fat)', '1/2 banana (medium)', '1/2 cup grape', '1/4 cup dry crunchy cereal (Grape Nuts or granola cereals are good)']","['Peel and slice the banana.', 'Spoon the grapes into a tall plastic cup.', 'Put 3 spoonsful of yogurt on top of the grapes.', 'Spoon sliced bananas on top of the yogurt.', 'Add the rest of the yogurt.', 'Sprinkle the cereal on top.']",Desserts,379,5 mg,9 g,67 g,5 g,48 g,11 g,220 mg,2 mg,17 mcg RAE,9 mg,1 mcg,49 mcg DFE
Fruit Yogurt Pops,14 servings,"['1 low fat yogurt, pina colada (8 ounces)', '2 1/2 cups strawberries (sliced frozen, thawed)']","['Combine ingredients. Pour into 3 ounce paper cups.', 'Freeze about 30 minutes; then stick a wooden popsicle/ craft stick in the center of each cup.', 'Freeze overnight until firm. To eat pops, peel off paper cups.', 'For variety, try other fruit flavored yogurts and frozen fruit or fruit juice concentrates.']",Desserts,26,1 mg,0 g,5 g,1 g,4 g,1 g,27 mg,0 mg,2 mcg RAE,18 mg,0 mcg,9 mcg DFE
Fudgy Fruit,4 servings,"['1/8 cup chocolate chips (or 2 tablespoons semi-sweet chips)', '2 bananas (large, peeled and cut into quarters)', '8 strawberries (large)', '1/4 cup peanuts (chopped, unsalted)']","['Wash hands with soap and water.', 'Place chocolate chips in a small microwave safe bowl. Heat on high for 10 seconds and stir. Repeat until chocolate is melted, about 30 seconds.', 'Place fruit on a small tray covered with a piece of waxed paper. Use a spoon to drizzle the melted chocolate on top of the fruit.', 'Sprinkle the fruit with chopped nuts.', 'Cover the fruit and place in the refrigerator for 10 minutes or until the chocolate hardens. Serve chilled.']",Desserts,151,0 mg,6 g,24 g,4 g,13 g,3 g,16 mg,1 mg,2 mcg RAE,27 mg,0 mcg,36 mcg DFE
Grilled Fruit,3 Servings,"['1 cup pineapple chunks', '1 peach (cubed)', '1 banana (sliced)']","['Place fruit chunks on a skewer to make kabobs.', 'Grill or broil on low heat until the fruit is hot and slightly golden.']",Desserts,104,0 mg,0 g,27 g,2 g,21 g,1 g,17 mg,0 mg,11 mcg RAE,15 mg,0 mcg,14 mcg DFE
Honey Milk Balls,20 servings,"['1/4 cup honey', '1/4 cup peanut butter', '1/2 cup dry milk, non-fat', '1/2 cup cereal (crushed)']","['Wash hands with soap and water.', 'Mix honey and peanut butter.', 'Gradually add dry milk and mix well.', 'Chill for easier handling.', 'With greased hands, form into small balls.', 'Roll in crushed cereal flakes.', 'Chill until firm.', 'Refrigerate leftovers within 2 hours.']",Desserts,41,0 mg,2 g,5 g,0 g,5 g,1 g,26 mg,0 mg,19 mcg RAE,0 mg,0 mcg,12 mcg DFE
Honey of a Pumpkin Bar,30 servings,"['1/3 cup dry milk, non-fat', '2 cups flour (all purpose)', '1 teaspoon baking soda', '2 1/2 teaspoons cinnamon', '1/2 teaspoon cloves', '1/2 teaspoon allspice', '1/2 teaspoon nutmeg', '1/3 cup vegetable oil', '2/3 cup honey', '1/2 cup orange juice', '2 tablespoons orange peel (grated)', '2 egg', '1 cup pumpkin (mashed)']","['1. Preheat oven to 350 degrees. Lightly grease or spray with non-stick spray a 12 x 15 inch baking pan with sides.', '2. In a small bowl, combine dry milk, flour, baking soda, and spices. Set aside.', '3. In a large bowl, thoroughly mix oil, honey, juice, peel, eggs and pumpkin.', '4. Gradually add flour mixture to pumpkin mixture, stirring until smooth.', '5. Spread batter onto prepared baking pan. Bake for 15 to 20 minutes, or until golden brown and cake springs back when lightly touched with your finger. Cool. Cut into squares.']",Desserts,88,13 mg,3 g,14 g,1 g,7 g,2 g,19 mg,1 mg,74 mcg RAE,3 mg,0 mcg,29 mcg DFE
Honeydew Summer Salad Wedges,8 servings,"['1 honeydew melon', '1 package gelatin, lemon flavored (3 ounce)', '1/2 cup water (boiling)', '1/2 cup water (iced)', 'ice cubes', '1 cup whole strawberries (hulled)']","['Cut melon in half; scoop out seeds.', 'Pat the inside of the melon dry using paper towels.', 'Dissolve gelatin in boiling water.', 'Combine ice water and ice cubes to make one cup.', 'Add to gelatin and stir until slightly thickened.', 'Remove any un-melted ice.', 'Place each melon half in a small bowl to hold straight and firm.', 'Place half of strawberries in each melon half.', 'Pour gelatin mixture over berries.', 'Cover with plastic wrap and chill until firm, about 3 hours.', 'To serve, cut into wedges.']",Desserts,93,0 mg,0 g,22 g,1 g,20 g,2 g,13 mg,0 mg,4 mcg RAE,33 mg,0 mcg,29 mcg DFE
Instant Chocolate Mousse,4 servings,"['1 box of instant chocolate pudding mix (3.9 ounce)', '1 1/4 cups soy milk (cold)', '1 package silken tofu (14 ounce)']","['1. Blend the chocolate pudding mix and the soy milk on medium speed for about 15 seconds until the mixture is very smooth.', '2. Add the silken tofu and blend again. Scrape the mixture down off the sides to be sure it’s all mixed in. Blend and scrape until well mixed and very smooth.', '3. Pour mixture into 4 small serving dishes.', '4. Place in the fridge. Chill for at least 2 hours before serving.']",Desserts,183,0 mg,4 g,29 g,1 g,22 g,8 g,176 mg,2 mg,40 mcg RAE,0 mg,1 mcg,40 mcg DFE
Ivory Coast Bananas with Caramel Sauce,12 servings,"['6 bananas (large)', '6 tablespoons butter', '1 cup sugar', '1/2 cup evaporated milk, skim', '2 teaspoons cornstarch, dissolved in 2 teaspoons water']","['1. Preheat oven to 400 degrees. Place unpeeled banana on a baking sheet. Prick the skin of each banana several times with the prongs of a fork. Cook the bananas for about 8 minutes. The skin will turn black.\n2. Over moderate heat, cook the butter, water and sugar to a medium brown color (it will look like caramel). Remove from heat.\n3. Combine the milk, cornstarch slurry to the caramel mixture. Stir to dissolve.\n4. Return to the heat and bring to a boil, stirring constantly.\n5. Remove from heat and cool slightly.\n6. Serve on top of the bananas that have been peeled and sliced lengthwise.\n ']",Desserts,178,16 mg,6 g,32 g,2 g,25 g,2 g,36 mg,0 mg,63 mcg RAE,5 mg,0 mcg,13 mcg DFE
Jean’s Banana Pudding Parfait,10 Servings,"['8 ginger snap cookies (crushed)', '7 medium ripe bananas (sliced thin)', '1 cup nonfat milk', '1 1-oz box instant sugar-free, fat-free vanilla pudding', '1 1/4 cups low-fat vanilla yogurt', '1 teaspoon vanilla extract', '1 cup fat-free frozen whipped topping (thawed)', '10 8-oz parfait cups or drinking glasses', '1/4 teaspoon cinnamon for garnish (optional)']","['In a large bowl, whisk together the milk and pudding mix; blend well (about 2 minutes).', 'Add yogurt and vanilla extract; blend until smooth.', 'Stir the thawed whipped topping into the mixture.', 'Line the bottom of the parfait cups with a teaspoon of crumbled ginger snaps.', 'Layer 6 banana slices on top of the cookies; then 2 tbsp of the yogurt mixture on top. Repeat with another layer of the ginger snaps, bananas, and yogurt mixture.', 'Top with cinnamon or crushed cookie for garnish.', 'Cover and chill in refrigerator.']",Desserts,170,3 mg,2 g,36 g,2 g,19 g,4 g,106 mg,1 mg,25 mcg RAE,7 mg,0 mcg,36 mcg DFE
Jiffy Oatmeal Crunch,30 servings,"['1/2 cup margarine or butter', '3/4 cup brown sugar (firmly packed)', '1 teaspoon vanilla', '1/2 teaspoon baking soda', '2 cups quick oats (uncooked)', '1 cup raisins']","['1. Preheat oven to 350 degrees and grease a 9 x 13 inch baking pan.', '2. In large skillet, melt butter and brown sugar.', '3. Remove from heat and stir in remaining ingredients.', '4. Spread into pan and bake for 15 - 20 minutes. Cool; cut into squares.']",Desserts,83,0 mg,3 g,13 g,1 g,8 g,1 g,10 mg,0 mg,31 mcg RAE,0 mg,0 mcg,2 mcg DFE
Lemon Corn Cake,12 servings,"['1 cup yellow corn meal', '1 cup flour', '1/2 cup sugar', '1 tablespoon baking powder', '1 teaspoon salt', '3/4 cup yogurt, low-fat lemon (about 6 oz)', '2 teaspoons lemon peel (finely grated)', '1 tablespoon oil', '1 egg yolk', '2/3 cup non-fat milk', '3 egg whites', 'non-stick cooking spray', '3 tablespoons lemon juice', '1/2 cup powdered sugar']","['1. Preheat oven to 400 degrees.\n2. Mix first five ingredients together in mixing bowl.\n3. Combine yogurt, lemon peel, oil, egg yolk and milk together and stir into dry ingredients just until blended.\n4. Whip egg whites with mixer until stiff. Fold into corn meal mixture.\n5. Pour into round 9-inch cake pan coated with nonstick cooking spray.\n6. Bake for 20-25 minutes or until corn cake tests done.\n7. For optional lemon glaze: Over low heat blend lemon juice together with powdered sugar. Pierce cake top repeatedly with fork. Slowly pour glaze evenly over the top.\n ']",Desserts,164,19 mg,2 g,33 g,1 g,16 g,4 g,116 mg,1 mg,17 mcg RAE,1 mg,0 mcg,38 mcg DFE
Lemon Velvet Supreme,6 servings,"['2 cups yogurt (vanilla, fat-free)', '1 ounce pudding mix (instant, lemon, 3 Tablespoons)', '8 graham crackers (rectangles, crushed)', '1 cup mandarin orange (4 ounce, slices, drained or your favorite fruit)']","['1. Combine vanilla yogurt and pudding mix; gently stir together.', '2. Layer bottom of serving dish with crushed graham crackers.', '3. Immediately pour pudding mixture over cracker crumbs.', '4. Top with mandarin orange slices or your favorite fruit.']",Desserts,138,2 mg,1 g,29 g,0 g,23 g,4 g,128 mg,0 mg,12 mcg RAE,6 mg,0 mcg,14 mcg DFE
Lisa's Famous Dessert,8 servings,"['1 instant pudding mix, banana or vanilla (3.5 ounce)', '2 cups milk, non-fat or low-fat', '1 yogurt, fat-free (8 ounce, or non-dairy whipped topping)', '2 banana (sliced, or other sliced fruit)']","['1. In a medium bowl, combine milk and pudding. Beat with wooden spoon, wire whisk, or electric mixer on lowest speed for 2 minutes', '2. Gently mix yogurt (or whipped topping) with pudding mixture. Refrigerate for 30 minutes.', '3. Layer fruit slices in the bottom of 8 dessert cups.', '4. Pour the pudding mixture over sliced fruit.', ""5. Refrigerate until ready to serve, at least 5 minutes, though it's better if it's refrigerated longer.""]",Desserts,108,2 mg,0 g,23 g,1 g,20 g,4 g,134 mg,0 mg,39 mcg RAE,3 mg,1 mcg,12 mcg DFE
Magical Fruit Salad,12 servings,"['1 can pineapple chunks (20 ounce)', '1/2 pound grapes, seedless, red or green', '2 bananas', '1 3/4 cups milk, non-fat or low-fat', '1 package pudding mix, instant, lemon or vanilla (3 1/2 ounce)']","['1. Drain off the juice. Put chunks in a large bowl.', '2. Rinse the grapes and drain. Add the grapes to the bowl.', '3. Peel the bananas and cut into bite-sized pieces. Add to the bowl.', '4. Pour the milk over the fruit. While slowly stirring the fruit mixture, sprinkle in the pudding mix.', '5. Let the mixture stand for 5 minutes and serve.', '6. Refrigerate leftovers within 2 hours.']",Desserts,99,1 mg,0 g,24 g,1 g,21 g,2 g,54 mg,0 mg,24 mcg RAE,7 mg,0 mcg,8 mcg DFE
Mango Shake,4 servings,"['2 cups milk (low-fat 1%)', '1 fresh pitted mango (or 4 Tablespoons of frozen mango juice)', '1 banana (medium)', '2 ice cubes']","['Wash hands with soap and water.', 'Put all ingredients into a blender.', 'Blend until foamy.', 'Serve immediately.']",Desserts,109,6 mg,1 g,21 g,2 g,17 g,5 g,160 mg,0 mg,100 mcg RAE,21 mg,1 mcg,34 mcg DFE
Matzo Meal Kugel (Pudding),12 Servings,"['4 eggs', '1 cup sugar', '4 cups milk, 1%', '5 tablespoons butter, melted', '2 cups matzo meal', '1 teaspoon salt']","['Wash hands with soap and water.', 'Combine eggs and sugar; beat well.', 'Add milk and melted butter; mix well.', 'Stir in matzo meal and salt.', 'Pour into buttered 11x13"" pan.', ""Bake at 350°F for 1 hour (don't over bake)."", 'Cut into slices. Can be served hot or cold.']",Desserts,241,71 mg,7 g,38 g,1 g,21 g,7 g,114 mg,1 mg,111 mcg RAE,0 mg,1 mcg,15 mcg DFE
Melon and Mint,8 Servings,"['1 tablespoon lime juice', '1/4 cup fresh mint leaves', '6 teaspoons packed brown sugar (2 Tablespoons)', '3 cups watermelon cubes', '3 cups honeydew cubes']","['Wash hands with soap and water.', 'Blend lime juice, mint leaves and brown sugar together in a small food processor.', 'Place melon cubes in a bowl. Drizzle dressing over melon and toss gently.']",Desserts,54,0 mg,0 g,14 g,1 g,12 g,1 g,13 mg,0 mg,20 mcg RAE,17 mg,0 mcg,15 mcg DFE
Microwave Baked Apple,4 servings,"['4 apple (large, baking)', '1/2 cup brown sugar', '1 teaspoon cinnamon']","['1. Wash apples and remove core.', '2. Cut a thin slice off bottom of each apple to form a flat surface. Place apples in a microwave safe baking dish.', '3. Mix brown sugar and cinnamon in a small dish. Spoon mixture into center of apples.', '4. Cover wax paper and microwave on high power 6 to 10 minutes or until apples are soft.']",Desserts,216,0 mg,0 g,57 g,5 g,49 g,1 g,42 mg,1 mg,6 mcg RAE,10 mg,0 mcg,7 mcg DFE
Mock Southern Sweet Potato Pie,16 servings,[],"['Wash hands with soap and water.', 'Preheat oven to 350 degrees.']",Desserts,139,35 mg,3 g,25 g,1 g,10 g,3 g,38 mg,1 mg,214 mcg RAE,13 mg,0 mcg,42 mcg DFE
Mousse a la Banana,4 servings,"['2 tablespoons milk (low-fat, 1%)', '4 teaspoons sugar', '1 teaspoon vanilla', '1 banana (medium, cut into quarters)', '1 cup yogurt (plain, low-fat)', '8 slices banana slices (1/4 inch)']","['1. Place milk, sugar, vanilla, and banana in blender. Process 15 seconds at high speed until smooth.', '2. Pour mixture into a small bowl; fold in yogurt. Chill. Spoon into four dessert dishes; garnish each with two banana slices just before serving.']",Desserts,98,4 mg,1 g,19 g,1 g,14 g,4 g,124 mg,0 mg,14 mcg RAE,4 mg,0 mcg,15 mcg DFE
No Bake Breakfast Cookies,12 servings,"['1/2 cup honey (or light corn syrup)', '1/2 cup non-fat dry milk (instant)', '1/2 cup raisins (or chopped dates)', '1/2 cup creamy peanut butter', '2 1/2 cups crushed flaked cereal']","['1. Heat honey and peanut butter in a medium saucepan over low heat. Stir until blended.', '2. Remove from heat. Stir in dry milk.', '3. Fold in cereal and raisins. Drop by heaping Tablespoons onto waxed paper to form mounds.', '4. Cool to room temperature. Store in refrigerator.']",Desserts,171,1 mg,6 g,27 g,2 g,20 g,5 g,47 mg,1 mg,20 mcg RAE,0 mg,0 mcg,14 mcg DFE
No-Bake Cookies,36 servings,"['2 cups sugar', '3 tablespoons cocoa powder (unsweetened)', '1/2 teaspoon salt', '1/2 cup margarine', '1 cup peanut butter', '1/2 cup water', '4 cups rolled oats', '1 cup non-fat dry milk', '1 cup raisins', '1 teaspoon vanilla']","['1. In large sauce pan, bring the first six ingredients to a full, rolling boil for 1 minute, stirring as needed.', '2. Remove from heat. Add oats, dry milk, and raisins and vanilla to boiled mixture.', '3. Mix well.', '4. Drop by Tablespoons onto waxed paper and let stand until cool, about 15-20 minutes.']",Desserts,163,0 mg,7 g,23 g,2 g,15 g,4 g,34 mg,1 mg,39 mcg RAE,0 mg,0 mcg,9 mcg DFE
Old Fashioned Bread Pudding,6 servings,"['5 slices bread, white or wheat', '2 tablespoons margarine or butter', '1/4 teaspoon cinnamon', '1/3 cup sugar, white or brown', '1/2 cup raisins', '3 egg (or 1 egg + 2 egg whites)', '1 1/2 cups non-fat milk', '1/4 teaspoon salt', '1 teaspoon vanilla extract']","['1. Spread one side of bread with margarine or butter. Sprinkle with cinnamon.', '2. Cut into 1-inch cubes.', '3. In lightly sprayed casserole dish, combine bread, sugar, and raisins. Then follow microwave or oven method below.', 'Microwave method:\n1. In bowl, blend eggs, milk, salt and vanilla. Pour liquid over bread mixture; lightly blend.', '2. Cover, microwave on HIGH for 5 minutes. Turn dish 1/4 turn. Microwave on HIGH for 3-5 minutes longer (pudding is done when edges are firm and center is almost set).', '3. Let sit covered for 10 minutes before serving. Serve warm or cold. Refrigerate leftovers.', 'Oven method:\n1. Preheat oven to 350 degrees. In bowl, blend eggs, 2 cups (instead of 1 1/4 cups for microwaving) milk, salt, and vanilla. Pour liquid over bread mixture; lightly blend.', '2. Bake uncovered for 1 hour (pudding is done when a table knife inserted in the pudding comes out clean).', '3. Serve warm or cold. Refrigerate leftovers.']",Desserts,231,94 mg,7 g,34 g,2 g,23 g,9 g,134 mg,1 mg,116 mcg RAE,0 mg,1 mcg,25 mcg DFE
