name,servings,ingredients,directions,type,calories,cholesterol,fat,carbohydrates,fiber,sugars,protein,calcium,iron,vitamin_a,vitamin_c,vitamin_d,folate
Hearty Salmon Skewers over Brown Rice,4 Servings,"['1 pound salmon', '3 cherry tomatoes (2 ounces)', '1 cup pineapple (cubed)', '2 cups cooked brown rice', '1 lemon, raw', 'kosher salt, freshly ground pepper, and paprika (to taste)', '8 skewers']","['Cook rice according to package instructions and set aside.', 'Clean fish and pat dry.', 'Cut salmon into 24 1/2-inch cubes and coat all sides with topping of kosher salt, freshly ground pepper, paprika, or any desired spice.', 'Cut fruit into cubes and cut tomatoes in half. Set aside.', 'Slide piece of salmon onto skewer, then tomato, then fruit. Repeat 3 times on each skewer (or until skewer is full).', 'Heat 1/2 cup of canola oil in large skillet over medium-high heat for one minute.', 'Place skewers in pan and turn every 2 minutes per side. Squeeze lemon on skewers as they are cooking.', 'To serve, place 1/2 cup rice on plates and with 2 skewers on top. Squeeze a hint of lemon, if desired.']",Main,333,61 mg,13 g,30 g,3 g,5 g,24 g,35 mg,1 mg,7 mcg RAE,33 mg,0 mcg,48 mcg DFE
Hearty Vegetable Beef Soup,4 servings,"['3/4 can chicken broth (low sodium, 14.5 oz)', '1/2 cup water', '2 cups mixed vegetables (frozen, for soup)', '1 can tomatoes (14.5 oz, broken up)', '4 ounces beef (cooked and diced)', '1 teaspoon thyme leaves (crushed)', '1 dash pepper', '1/4 teaspoon salt', '1 bay leaf', '1 1/4 cups noodles (narrow-width, uncooked)']","['Wash hands with soap and water', 'Heat broth and water. Add vegetables, meat, and seasonings. Bring to boil. Reduce heat and boil gently, uncovered, for 15 minutes.', 'Add noodles. Cook until noodles are tender, about 10 minutes', 'Remove bay leaf. Serve.']",Main,173,28 mg,3 g,25 g,6 g,6 g,12 g,73 mg,3 mg,217 mcg RAE,16 mg,0 mcg,76 mcg DFE
Herb Broiled Beef,4 servings,"['1/4 cup onion (chopped)', '2 tablespoons parsley', '2 tablespoons white vinegar', '3 teaspoons prepared mustard', '1/4 teaspoon garlic powder', '1/4 teaspoon basil, dried (or thyme)', '1 pound boneless beef chuck shoulder steak, cut 1-inch thick']","['1. Mix onion, parsley, vinegar, mustard, garlic powder and basil or thyme.', '2. Place meat in plastic bag and pour in marinade.', '3. Close bag securely, place in a bowl and marinate in refrigerator six to eight hours or overnight, turning at least once.', '4. Pour off marinade and discard. Place meat on rack in broiler.', '5. Broil 15 to 20 minutes or until desired doneness, turning once.', '6. Cut into thin slices to serve.']",Main,155,71 mg,5 g,2 g,0 g,1 g,24 g,21 mg,2 mg,8 mcg RAE,3 mg,0 mcg,14 mcg DFE
Herbed Garden Pizza,4 Servings,"['2 tablespoons salt-free Tomato Basil Garlic Seasoning Blend', '2 tablespoons olive oil', '1 12-inch, whole-wheat pizza crust, thin, pre-baked', 'cooking spray', '4 Roma tomatoes (thinly sliced)', '1 1/2 cups crimini mushrooms (sliced)', '2 cups baby spinach', '1/2 cup thinly sliced red onion', '3/4 cup shredded fat-free mozzarella cheese']","['Place rack in center of oven and preheat oven to 400 °F.', 'In a small bowl, mix Tomato Basil Garlic Seasoning Blend with olive oil.', 'Place pizza crust on pizza pan. Brush pizza dough with olive oil blend, reserve remainder.', 'In a large mixing bowl, gently toss vegetables and remaining olive oil blend.', 'Spread coated vegetables evenly over pizza dough, leaving about 1/2-inch border around the edges. Top vegetables with shredded cheese.', 'Bake 10 minutes, until cheese is melted.']",Main,300,5 mg,17 g,42 g,8 g,0 g,10 g,200 mg,3 mg,123 mcg RAE,12 mg,0 mcg,62 mcg DFE
Honey Lemon Chicken,8 servings,"['1 tablespoon vegetable oil', '1 pound chicken (cut into 8 pieces)', '1/2 cup flour (all purpose)', '1 teaspoon salt', '1/4 cup honey', '1/4 cup lemon juice', '1 teaspoon rosemary (fresh or dried)']","['Wash hands with soap and water.', 'Preheat oven to 375 degrees. Line a baking pan with foil for easy clean up. Lightly oil the foil.', 'Combine flour and salt in a plastic bag. Shake chicken pieces in flour mixture, remove from bag and place on prepared pan.', 'Bake for 45 minutes.', 'Combine honey, lemon and rosemary. Spoon mixture over chicken to glaze chicken pieces. Bake another 15 minutes.\n ']",Main,115,22 mg,3 g,15 g,0 g,9 g,8 g,7 mg,1 mg,5 mcg RAE,3 mg,0 mcg,26 mcg DFE
Honey Mustard Pork Chops,4 servings,"['4 top loin pork chops', '1/3 cup orange juice', '1 tablespoon soy sauce, reduced sodium', '2 tablespoons light honey mustard']","['Wash hands with soap and water.', 'Put the pork chops in the large non-stick skillet.', 'Cook over medium-high heat to brown one side of the pork chops.', 'Use the spatula to turn the chops.', 'Add the rest of the ingredients and stir.', 'Cover the pan and lower the heat.', 'Simmer for 6 to 8 minutes until chops are done.\n ']",Main,238,88 mg,6 g,4 g,0 g,3 g,38 g,18 mg,1 mg,5 mcg RAE,10 mg,1 mcg,8 mcg DFE
Hooked on Salmon Sticks,8 servings,"['1 can pink salmon (16 ounces, drained)', '16 saltine crackers (crushed, about 1/2 cup)', '1 egg', '1 tablespoon vegetable oil', 'non-stick cooking spray']","['1. In a large mixing bowl, combine salmon, cracker crumbs and egg.\n2. Divide mixture into 8 balls and shaped into sticks about 4 inches long.\n3. Lightly coat a skillet with cooking spray. Add oil and preheat the skillet on medium for 1 to 2 minutes. Add fish sticks and cook for 3 minutes.\n4. Flip over and cook about 3 minutes or until golden brown.\n ']",Main,112,50 mg,5 g,5 g,0 g,0 g,11 g,106 mg,1 mg,22 mcg RAE,0 mg,7 mcg,22 mcg DFE
"Hoppin' John (Sausage, Black-Eyed Peas, and Rice)",4 Servings,"['1/2 cup brown rice, instant uncooked (or white rice)', '1 teaspoon canola oil (or corn oil)', '3 ounces low-fat smoked turkey sausage ring, quartered lengthwise and cut into 1/4-inch pieces (lowest fat and sodium available)', '1/2 red bell pepper (medium, chopped)', '1 jalapeño pepper, medium (seeded and finely chopped)', '1 can black eyed peas (no salt added, rinsed and drained)', '1/2 cup water', '1 teaspoon salt']","['Prepare the rice using the package directions, omitting the salt and butter/margarine.', 'Meanwhile, in a medium non-stick skillet, heat the oil over medium-high heat, swirling to coat the bottom. Cook the sausage for 3 minutes or until richly browned, stirring frequently.', 'Stir in the bell pepper and jalapeño pepper. Cook for 1 minute.', 'Stir in the peas, water, and salt. Cook for 2 minutes, or until the mixture is thickened slightly but some liquid remains. Remove from the heat.', 'Let stand, covered, for 5 minutes so the flavors bend. Stir in the rice. Transfer to a serving bowl.\n ']",Main,224,4 mg,3 g,43 g,7 g,4 g,7 g,148 mg,2 mg,47 mcg RAE,21 mg,0 mcg,141 mcg DFE
Hot-Wing-Flavored Chicken with Ranch Sauce,4 Servings,"['2 teaspoons hot pepper sauce (or to taste)', '1 tablespoon lemon juice, fresh', '2 teaspoons olive oil', '4 chicken breast, boneless and skinless, all visible fat discarded (about 4 ounces each) (halved)', '1 cup cornflake crumbs (about 2 cups flakes)', '1/4 cup sour cream, light (or fat-free)', '1/4 cup buttermilk, 1% low-fat', '1/2 teaspoon garlic powder', '1/4 teaspoon dried dillweed (crumbled)']","['1. In a large shallow bowl, stir together the hot pepper sauce, lemon juice, and olive oil.\n2. Add the chicken and turn to coat. Cover and refrigerate for 30 minutes to 8 hours, turning occasionally if longer than 30 minutes. Discard the marinade.\n3. Preheat the oven to 375°F. Lightly spray an 8-inch square baking pan with vegetable oil spray.\n4. Put the cornflake curmbs on a plate. Turn the chicken to coat both sides. Transfer to the baking pan.\n5. Lightly spray the top of the chicken with vegtable oil spray. Bake for 30 minutes, or until the chicken reaches an internal temperature of 165°F and the coating is crisp. Transfer to a serving plate.\n6. Meanwhile, in a small bowl, whisk together the remaining ingredients. Cover and refrigerate until ready to serve. Spoon the sauce over the chicken or use as a dipping sauce.\n ']",Main,157,48 mg,6 g,8 g,0 g,2 g,17 g,50 mg,3 mg,59 mcg RAE,4 mg,0 mcg,46 mcg DFE
Huevos Rancheros with Fresh Salsa,4 Servings,"['4 corn tortillas (6 inch)', '1/2 tablespoon vegetable oil', 'non-stick cooking spray', '4 egg whites (medium)', '4 eggs (medium)', '1/8 teaspoon black pepper (ground)', '4 tablespoons cheese, shredded cheddar or monterey jack', '2 cups fresh salsa']","['Preheat oven to 450 degrees.', 'Wash hands with soap and water.', 'Lightly brush tortillas with oil on both sides and place on a baking sheet.', 'Bake for 5 to 10 minutes or until tortillas are crisp on the edges and starting to brown.', 'Remove from oven and set aside.', 'Spray a large skillet with non-stick cooking spray over medium heat.', 'Drop 4 egg whites into skillet, then, break whole eggs over whites to make 4 separate servings.', 'Cook for 2-3 minutes per side until eggs are cooked.', 'Place one egg on each tortilla shell and top each with 1 Tablespoon cheese', 'Place under the broiler for about 2 minutes until cheese is melted.', 'Spoon 1/2 cup fresh salsa around the edge of each shell.']",Main,204,193 mg,10 g,16 g,3 g,3 g,14 g,114 mg,2 mg,129 mcg RAE,13 mg,1 mcg,42 mcg DFE
Indian Vegetable and Rice Skillet Meal,10 servings,"['2 teaspoons vegetable oil', '1 onion (chopped)', '1 teaspoon ground ginger', '1/2 teaspoon turmeric', '1/2 teaspoon cumin', '2 cups mixed vegetables (chopped cauliflower, peppers, carrots, or peas)', '1 baking potato (large)', '1 cup white rice (uncooked)', '2 1/2 cups water', '1 can kidney beans (15 ounces, drained, rinsed)', '1/2 salt (1/2 teaspoon, optional)']","['1. Heat oil in a large skillet over medium heat.\n2. Add onion, ginger, turmeric, and cumin, and stir while cooking for 1 minute.\n3. Add remaining ingredients. Bring to a boil, cover, and reduce heat.\n4. Simmer 20-25 minutes. Serve hot.\n5. Refrigerate leftovers with in 2-3 hours.\n ']",Main,171,0 mg,1 g,34 g,5 g,2 g,6 g,32 mg,2 mg,78 mcg RAE,10 mg,0 mcg,104 mcg DFE
Italian Bean Patties,8 servings,"['2 cups beans, low-sodium (canned or cooked)', '1 egg (beaten)', '1/2 teaspoon garlic powder', '1/2 teaspoon onion powder', '2 teaspoons Italian seasoning', '1 cup bread crumbs (dry, or cracker crumbs)', '1/8 cup cornmeal (or all purpose flour)', '2 tablespoons vegetable oil']","['1. In a large bowl, mash beans. Add egg and spices and stir to mix evenly.\n2. Stir in bread crumbs. If mixture seems too wet add more breadcrumbs, 1 Tablespoon at a time until mixture resembles meatloaf.\n3. Shape into little sausages or patties. Roll in cornmeal or flour.\n4. Fry slowly in vegetable oil over medium heat until crusty and golden brown.\n ']",Main,140,23 mg,5 g,19 g,4 g,1 g,5 g,50 mg,2 mg,11 mcg RAE,1 mg,0 mcg,53 mcg DFE
Italian Broccoli and Pasta,4 servings,"['6 ounces fettucini noodles, uncooked', '3 tablespoons green onion (chopped, also called scallions)', '2 cups broccoli florets', '1/2 teaspoon thyme (dried)', '1/2 teaspoon oregano (dried)', '1/2 teaspoon black pepper', '1 can stewed tomatoes (low-sodium, 14.5 ounce)', '2/3 tablespoon Parmesan cheese (grated)']","['1. Cook noodles according to package instructions (do not include oil or salt), and drain.\n2. Spray a medium skillet with non-stick cooking spray; stir-fry onion and broccoli for 3 minutes over medium heat.\n3. Add seasonings (but not the Parmesan cheese) and tomatoes; simmer until heated through.\n4. Spoon vegetable mixture over noodles and top with Parmesan cheese.\n ']",Main,194,1 mg,1 g,39 g,4 g,4 g,8 g,76 mg,3 mg,22 mcg RAE,42 mg,0 mcg,201 mcg DFE
Jamaican Jerk Chicken,10 servings,"['1/2 teaspoon cinnamon (ground)', '1 1/2 teaspoons allspice (ground)', '1 1/2 teaspoons black pepper (ground)', '1 tablespoon hot pepper (chopped)', '1 teaspoon hot pepper (crushed, dried)', '2 teaspoons oregano (crushed)', '2 teaspoons thyme', '1/2 teaspoon salt', '6 garlic clove (finely chopped)', '1 cup onion (pureed or finely chopped)', '1/4 cup vinegar', '9 teaspoons brown sugar (3 Tablespoons)', '8 pieces of chicken, skinless (4 drumsicks, 4 breasts)']","['Wash hands with soap and water.', 'Combine all ingredients except chicken in large bowl. Rub seasonings over chicken and marinate in refrigerator for 6 hours or longer.', 'Preheat oven to 350 degrees Fahrenheit.', 'Space chicken evenly on non-stick or lightly greased baking pan.', 'Cover with aluminum foil and bake for 40 minutes. Remove foil and continue baking for an additional 30–40 minutes or until the meat can easily be pulled away from the bone with a fork.']",Main,161,68 mg,3 g,7 g,1 g,5 g,25 g,35 mg,1 mg,10 mcg RAE,3 mg,0 mcg,8 mcg DFE
Jollof Rice,12 Servings,"['2 pounds cooked meat, cut into 1-inch cubes (use chicken, bacon, shrimp, or smoked pork)', '1 tablespoon olive oil', '1/2 cup onion, yellow (finely chopped)', '1/2 cup green peppers (finely chopped)', 'ground ginger (1/2 teaspoon, optional)', '1 can whole tomatoes (14.5 ounces)', '2 cans tomato paste (6 ounces each) (no salt added)', '8 cups water (2 quarts)', '1/2 teaspoon black pepper', '1/2 teaspoon thyme', '1 teaspoon crushed red pepper', '2 cups white rice', '2 1/2 cups chicken broth, reduced sodium', '2 1/2 cups water']","['1. Sauté cooked meat in oil until slightly brown.\n2. In a large kettle, sauté yellow onion, green pepper, and ginger in vegetable oil until onions are soft.\n3. Add whole tomatoes and simmer for five minutes.\n4. Add tomato paste, 2 quarts water, salt, black pepper, thyme, and red pepper.\n5. Add cooked meat, simmer 20 minutes longer.\n6. In a 2-quart saucepan, cook rice in 5 cups of chicken stock and water until tender.\n7. Add salt and pepper to taste.\n8. Pour the rice in a deep bowl and arrange the meat in the center.']",Main,284,32 mg,11 g,33 g,2 g,5 g,13 g,47 mg,3 mg,56 mcg RAE,16 mg,0 mcg,98 mcg DFE
Kelly's Herbed Lentils and Rice Casserole,4 servings,"['2 2/3 cups chicken broth', '3/4 cup lentils (sorted and rinsed)', '3/4 cup onion (chopped)', '1/2 cup brown rice (raw)', '1/4 cup water', '1/2 teaspoon basil', '1/2 teaspoon oregano', '1/2 teaspoon thyme', '1/2 cup mozzarella cheese, part-skim (divided)']","['1. In a 2 1/2 quart casserole dish add the chicken broth, lentils, onions, brown rice, water, spices and 1/4 cup mozzarella cheese.\n2. Cover and bake at 350º for 2 hours, adding more broth if casserole seems dry.\n3. Top with remaining cheese and bake another 2 or 3 minutes until all the cheese is melted.\n ']",Main,267,8 mg,4 g,42 g,10 g,3 g,16 g,155 mg,4 mg,23 mcg RAE,15 mg,0 mcg,195 mcg DFE
Kibbeh Khamoustah,8 Servings,"['1 pound ground beef, 85% lean (coarsely ground, if available)', '1 tablespoon salad oil', '1 cup matzo meal', '1 1/2 cups semolina', '1 cup water', '1 teaspoon salt', '6 cloves garlic, chopped (use 6-7 cloves)', '10 scallions, chopped', '6 cups Swiss Chard (2 bunches)', 'lemon juice (optional)']","['Fry ground beef in a small amount of oil.', 'Prepare the dough by mixing matzo meal, semolina, water, and salt.', 'Wet hands and shape into walnut-sized pieces.', 'Roll out dough into a small circle and fill with 1 Tablespoon of meat.', 'Seal the dough. Continue until all the dough and meat is used.', 'In a large pot, heat a small amount of oil and fry garlic until golden.', 'Add the scallions and Swiss chard. Mix well.', 'Cook about 10 minutes.', 'Cover with water and continue to cook until boiling.', 'Add lemon juice, to taste (optional).', 'Add stuffed dough to soup and cook 15 more minutes.']",Main,300,37 mg,8 g,38 g,3 g,1 g,17 g,48 mg,4 mg,92 mcg RAE,12 mg,0 mcg,104 mcg DFE
Leafy Tofu,6 servings,"['1 package tofu', '1 tablespoon oil', '4 cups spinach (2 bunches of fresh spinach)', '2 tablespoons soy sauce, reduced sodium', '1/3 tablespoon sesame seeds (1 teaspoon, toasted)']","['Wash hands with soap and water.', 'Drain tofu.', 'Dice tofu into 1-inch cubes.', 'Tear spinach into bite-sized pieces.', 'In a large pan, heat oil and saute tofu cubes for a few minutes. Move tofu to the center of the pan.', 'Add spinach, and soy sauce. Mix.', 'Cover pan and cook until spinach is wilted.', 'Sprinkle toasted sesame seeds.']",Main,77,0 mg,5 g,2 g,1 g,1 g,7 g,154 mg,2 mg,94 mcg RAE,6 mg,0 mcg,54 mcg DFE
Leftover Turkey Casserole,6 Servings,"['6 slices bread, whole wheat', '4 ounces cubed turkey', '1/2 cup onion, chopped', '1/2 cup celery, chopped', '1/2 teaspoon pepper', '2 eggs, lightly beaten', '1 1/2 cups milk, 1%', '1 can cream of mushroom soup, low-sodium (10.75 ounces)', '2 slices bread, whole wheat', '2 teaspoons margarine', '1/2 cup cheddar cheese, low-fat shredded (or jack cheese)', '1/2 cup mayonnaise, light']","['1. Lightly coat a 9x9x2-inch baking dish with vegetable spray. Cut 6 slices of bread (fresh or day-old) into 1-inch cubes and place half into the bottom of a baking dish.\n2. In a bowl, combine turkey, onion, celery, mayonnaise, and pepper. Spoon mixture over bread crumbs.\n3. Place remaining bread cubes over turkey mixture and press down slightly with spoon.\n4. Combine eggs and milk and pour mixture over cubes. Cover and refrigerate overnight.\n5. When ready to bake, preheat oven to 325°F\n6. Spoon soup over top of casserole.\n7. Spread one teaspoon margarine on side of each slice of bread. Cut buttered bread into 1/2-inch cubes and sprinkle on top of casserole.\n8. Bake for 60 minutes or until knife inserted in middle comes out clean. Remove from oven and sprinkle cheese over top. Let stand 15 minutes before cutting and serving.']",Main,277,79 mg,11 g,27 g,3 g,7 g,17 g,201 mg,2 mg,82 mcg RAE,1 mg,1 mcg,41 mcg DFE
Lemon Pepper Salmon Patties,5 Servings,"['3/4 cup breadcrumbs', '1/4 cup reduced fat mayonnaise', '1 egg, slightly beaten (can also use dried egg mix)', '1/2 teaspoon lemon pepper', '7 ounces frozen salmon, thawed, drained, and finely chopped (optional to remove the skin)', 'Cooking spray']","['Mix breadcrumbs, mayonnaise, egg, and lemon pepper in a medium bowl. Add salmon and mix.', 'Measure 1/3 cup of salmon mixture(packed) and form into a round patty. Repeat until you have five salmon patties.', 'Spray a skillet with cooking spray and set stove to medium heat.', 'Place the salmon patties in the skillet and cook until light brown, 5–7 minutes. Flip the patties and cook on the other side until brown. Salmon should reach a final internal cook temperature of 145°F as measured with a food thermometer before serving.']",Main,190,62 mg,11 g,12 g,1 g,1 g,11 g,41 mg,1 mg,17 mcg RAE,1 mg,0 mcg,43 mcg DFE
Lentil Spaghetti Sauce,6 servings,"['1 pound ground beef, 90% lean', '1 cup onion (chopped)', '1 garlic clove (crushed, or 1/2 teaspoon garlic powder)', '1 1/2 cups lentils (cooked, drained)', '28 ounces spaghetti sauce, low-sodium (1 jar, can use 28-32 ounces)']","['1. In a large sauce pan brown meat. Drain.', '2. Add onion and garlic to drained meat. Cook until onions are soft but not brown.', '3. Add cooked lentils and spaghetti sauce and bring to a boil. Lower heat and cook gently for 15 minutes.', '4. Serve sauce over hot cooked spaghetti noodles.']",Main,251,50 mg,8 g,23 g,7 g,9 g,21 g,60 mg,4 mg,44 mcg RAE,5 mg,0 mcg,113 mcg DFE
Lentil Stew,10 servings,"['2 teaspoons olive oil (or canola oil)', '1 onion (large, chopped)', '1 teaspoon garlic powder', '1 1/2 10-ounce packages of frozen sliced carrots', '1 cup dry lentils (rinsed and drained)', '3 cans diced tomatoes (14.5 ounces each)', '3 cups water', '1 teaspoon chili powder']","['1. Heat the oil in a large pot over medium heat.', '2. Add chopped onion.', '3. Cook for 3 minutes, or until tender.', '4. Stir in garlic powder, carrots, lentils, tomatoes, water and chili powder.', '5. Simmer, uncovered, for about 20 minutes or until lentils are tender.']",Main,161,0 mg,2 g,28 g,12 g,7 g,10 g,80 mg,4 mg,379 mcg RAE,19 mg,0 mcg,189 mcg DFE
Lentil Tacos,6 servings,"['1 1/2 cups dry lentils (sorted and rinsed)', '4 cups water', '1/2 green pepper (chopped)', '4 cloves garlic (minced)', 'hot pepper flakes (1/2 teaspoon, optional)', '1 teaspoon chili powder', '1 teaspoon cumin', '1/2 teaspoon basil', '2/3 cup tomato paste', '1/4 cup raisins (optional)']","['1. Cook lentils in 3 cups water for 10 minutes.', '2. Add remaining ingredients and simmer for 30 minutes\n(Add more water if necessary).', '3. Serve with corn tortillas. Can also be served over rice or noodles.']",Main,189,0 mg,1 g,34 g,12 g,6 g,14 g,53 mg,6 mg,32 mcg RAE,20 mg,0 mcg,250 mcg DFE
Mac and Beans Medley,4 servings,"['4 garlic clove', '1 bell pepper (green, red, yellow, or orange)', '2 tablespoons oil', '1 can tomatoes (14-15 ounces, diced)', '1 can beans (15.5 ounces, black, kidney, pinto or other, drained and rinsed)', '1/2 teaspoon red pepper flakes (crushed)', '2 cups macaroni (cooked, without salt or fat added or other pasta)']","['1. Wash hands with warm water and soap.', '2. Peel and finely chop the garlic. Core, seed, and finely chop the bell pepper.', '3. Heat oil in large skillet over medium-high heat. Add garlic and bell pepper. Cook for one minute. Do not let garlic brown. Add diced tomatoes (do not drain) and red pepper flakes.', '4. Cover the skillet and lower heat. Cook for 10 minutes or until sauce is slightly thickened.', '5. Add beans and cooked macaroni to skillet and cook 5 minutes or until heated through.', '6. Serve hot.']",Main,340,0 mg,8 g,54 g,13 g,4 g,14 g,108 mg,5 mg,35 mcg RAE,38 mg,0 mcg,189 mcg DFE
Macaroni & Cheese with Broccoli,6 Servings,"['2 cups uncooked elbow macaroni', '4 tablespoons flour', '2 cups milk (1%, low fat)', '2 cups cheddar cheese, low-fat shredded', '1/2 teaspoon pepper', '2 cups broccoli (cooked and chopped)']","['Wash hands with soap and water.', 'Cook macaroni, following the instructions on the package.', 'Drain the cooked macaroni and return to the pan.', 'While the macaroni is still warm, sprinkle in the flour and stir thoroughly.', 'Over medium heat, slowly stir the milk into the macaroni.', 'Add the cheese and pepper.', 'Stir over medium heat until the milk and cheese thicken into a creamy sauce, approximately 7-10 minutes.', 'Stir in the broccoli; heat thoroughly.', 'Taste; add a small amount of salt, if needed.', 'Refrigerate leftovers.']",Main,287,12 mg,4 g,42 g,4 g,6 g,20 g,292 mg,2 mg,101 mcg RAE,24 mg,1 mcg,164 mcg DFE
Magic Crust Quiche,6 Servings,"['1 tablespoon vegetable oil', '1/2 cup onion (chopped)', '2 cups vegetables, frozen, no salt added (or use fresh or leftovers)', '1 cup cheddar cheese, low-fat (shredded)', '3 eggs', '1 1/2 cups milk, 1%', '3/4 cup baking mix (like Bisquick)']","['Wash hands with soap and water.', 'Cook onion in oil (or cook with vegetables).', 'Cook vegetables (or use leftovers). Drain well.', 'Grease round pie pan or 8 x 8 inch baking dish.', 'Spread cooked vegetables in pan. Spread cheese on top of vegetables.', 'Mix milk, eggs and baking mix. Pour over vegetables and cheese.', 'Bake at 350 degrees F for 35 minutes, until a safe internal temperature has been reached and a knife inserted into the middle comes out clean.']",Main,215,89 mg,8 g,22 g,4 g,8 g,13 g,213 mg,2 mg,211 mcg RAE,3 mg,1 mcg,73 mcg DFE
Main Dish Salad,12 servings,"['1/2 head of red cabbage', '1/2 head of romaine lettuce', '3 carrot (medium)', '1 cucumber', '1 green pepper', '2 broccoli stalks', '3 tomatoes (medium)', '3 cans kidney beans or garbanzo beans (16 ounce)', '6 ounces cheese, grated low-fat cheddar', '1/4 cup salad dressing, non-fat']","['Wash hands with soap and water.', 'Wash and drain all vegetables well.', 'Thickly slice red cabbage, tear lettuce into pieces, peel and grate (or slice) carrots and cucumber, cut broccoli into florets and tomato into wedges.', 'Combine all salad ingredients in a bowl.', 'Add salad dressing and toss together lightly just before serving.']",Main,157,3 mg,2 g,26 g,9 g,6 g,12 g,166 mg,3 mg,275 mcg RAE,131 mg,0 mcg,178 mcg DFE
Manhattan Clam Chowder,9 servings,"['3 celery (stalks, medium - washed & sliced)', '1 onion (large, chopped)', '1/2 cup tomato puree (low sodium)', '1 1/2 cups potatoes (sliced)', '1 1/2 cups carrot (washed and sliced)', '2 cans clams (6 1/2 ounces each, chopped, drained)', '1 1/2 teaspoons thyme (dried)', '1 bay leaf', '2 dashes black peppercorns', '1 1/2 cups water', '2 cups tomato juice (low sodium )', '1 tablespoon parsley flakes (dried)']","['1. Scrub potatoes well to remove any eyes or blemishes.', '2. In a slow cooker, combine all ingredients; stir.', '3. Cover and cook on low for 8-10 hours or until the vegetables are tender.', '4. Remove bay leaf and peppercorns before serving.']",Main,98,16 mg,1 g,14 g,2 g,5 g,9 g,55 mg,2 mg,240 mcg RAE,18 mg,0 mcg,31 mcg DFE
Marinated Beef,4 servings,"['12 ounces beef round steak', '1 garlic clove', '2 tablespoons lemon juice', '4 tablespoons vegetable oil', '1/2 teaspoon salt', '1/2 teaspoon black pepper']","['1. Using a cutting board and sharp knife, cut round steak across the grain into thin strips about 1/2 inch wide and 2 to 3 inches long.', '2. In a medium glass mixing bowl, combine garlic, lemon juice, 2 Tablespoons of vegetable oil, salt and pepper.', '3. Add beef strips and stir to coat with the oil mixture (marinade sauce). Cover bowl with plastic wrap and refrigerate for about 2 hours.', '4. In a medium skillet over medium-high heat, heat 2 Tablespoons of the oil for 1-2 minutes until hot.', '5. Drain marinade from beef. Put beef in skillet, stir and cook for 5 to 7 minutes or until meat is thoroughly browned.']",Main,219,42 mg,18 g,1 g,0 g,0 g,14 g,6 mg,1 mg,0 mcg RAE,3 mg,0 mcg,6 mcg DFE
